contest_id,index,name,rating,solved_count,tags
1373,G,Pawns,2600,235,"data structures, divide and conquer, greedy"
1373,F,Network Coverage,2400,696,"binary search, constructive algorithms, data structures, greedy"
1373,E,Sum of Digits,2200,1416,"brute force, constructive algorithms, dp, greedy"
1373,D,Maximum Sum on Even Positions,1600,6542,"dp, greedy, implementation"
1373,C,Pluses and Minuses,1300,10204,math
1373,B,01 Game,900,13927,games
1373,A,Donut Shops,1000,12769,"greedy, implementation, math"
1370,F2,The Hidden Pair (Hard Version),2700,611,"binary search, dfs and similar, graphs, interactive, shortest paths, trees"
1370,F1,The Hidden Pair (Easy Version),2400,722,"binary search, dfs and similar, graphs, interactive, shortest paths, trees"
1370,E,Binary Subsequence Rotation,2100,2820,"binary search, constructive algorithms, data structures, greedy"
1370,D,Odd-Even Subsequence,2000,4741,"binary search, dp, dsu, greedy, implementation"
1370,C,Number Game,1400,11613,"games, math, number theory"
1370,B,GCD Compression,1100,14014,"constructive algorithms, math, number theory"
1370,A,Maximum GCD,800,19020,"greedy, implementation, math, number theory"
1369,F,BareLee,2700,240,"dfs and similar, dp, games"
1369,E,DeadLee,2400,1040,"data structures, dfs and similar, greedy, implementation, sortings"
1369,D,TediousLee,1900,4791,"dp, graphs, greedy, math, matrices, trees"
1369,C,RationalLee,1400,10260,"greedy, math, sortings, two pointers"
1369,B,AccurateLee,1200,13476,"greedy, implementation, strings"
1369,A,FashionabLee,800,18228,"geometry, math"
1368,H2,Breadboard Capacity (hard version),3500,21,
1368,H1,Breadboard Capacity (easy version),3300,39,"dp, flows, greedy"
1368,G,Shifting Dominoes,3200,63,"data structures, geometry, graphs, trees"
1368,F,Lamps on a Circle,2600,469,"games, implementation, interactive, math"
1368,E,Ski Accidents,2500,1147,"constructive algorithms, graphs, greedy"
1368,D,"AND, OR and square sum",1700,6094,"bitmasks, greedy, math"
1368,C,Even Picture,1500,8412,constructive algorithms
1368,B,Codeforces Subsequences,1500,10144,"brute force, constructive algorithms, greedy, math, strings"
1368,A,C+=,800,16665,"brute force, greedy, implementation, math"
1367,F2,Flying Sort (Hard Version),2400,591,"binary search, data structures, dp, greedy, sortings, two pointers"
1367,F1,Flying Sort (Easy Version),2100,1545,"dp, greedy, two pointers"
1367,E,Necklace Assembly,1900,2985,"brute force, dfs and similar, dp, graphs, greedy, number theory"
1367,D,Task On The Board,1800,4854,"constructive algorithms, greedy, implementation, sortings"
1367,C,Social Distance,1300,12898,"constructive algorithms, greedy, math"
1367,B,Even Array,800,20310,"greedy, math"
1367,A,Short Substrings,800,22093,"implementation, strings"
1366,G,Construct the String,2700,242,"data structures, dp, strings"
1366,F,Jog Around The Graph,2700,301,"binary search, dp, geometry, graphs"
1366,E,Two Arrays,2100,2405,"binary search, brute force, combinatorics, constructive algorithms, dp, two pointers"
1366,D,Two Divisors,2000,5449,"constructive algorithms, math, number theory"
1366,C,Palindromic Paths,1500,8302,"greedy, math"
1366,B,Shuffle,1300,11948,"math, two pointers"
1366,A,Shovels and Swords,1100,15008,"binary search, greedy, math"
1365,G,Secure Password,2800,393,"bitmasks, combinatorics, constructive algorithms, interactive, math"
1365,F,Swaps Again,2100,2848,"constructive algorithms, implementation, sortings"
1365,E,Maximum Subsequence Value,1900,5047,"brute force, constructive algorithms"
1365,D,Solve The Maze,1700,7706,"constructive algorithms, dfs and similar, dsu, graphs, greedy, implementation, shortest paths"
1365,C,Rotation Matching,1400,12102,"constructive algorithms, data structures, greedy, implementation"
1365,B,Trouble Sort,1300,14151,"constructive algorithms, implementation"
1365,A,Matrix Game,1100,15671,"games, greedy, implementation"
1364,E,X-OR,2700,516,"bitmasks, constructive algorithms, divide and conquer, interactive, probabilities"
1364,D,Ehab's Last Corollary,2100,2266,"constructive algorithms, dfs and similar, graphs, greedy, implementation, trees"
1364,C,Ehab and Prefix MEXs,1600,7237,"brute force, constructive algorithms, greedy"
1364,B,Most socially-distanced subsequence,1300,11035,"greedy, two pointers"
1364,A,XXXXX,1200,12935,"brute force, data structures, number theory, two pointers"
1363,F,Rotating Substrings,2600,625,"dp, strings"
1363,E,Tree Shuffling,2000,4057,"dfs and similar, dp, greedy, trees"
1363,D,Guess The Maximums,2100,2698,"binary search, implementation, interactive, math"
1363,C,Game On Leaves,1600,9680,"games, trees"
1363,B,Subsequence Hate,1400,12297,"implementation, strings"
1363,A,Odd Selection,1200,16975,"brute force, implementation, math"
1362,C,Johnny and Another Rating Drop,1400,10487,"bitmasks, greedy, math"
1362,B,Johnny and His Hobbies,1200,11845,"bitmasks, brute force"
1362,A,Johnny and Ancient Computer,1000,14702,implementation
1361,F,Johnny and New Toy,3300,47,"data structures, implementation, math"
1361,E,James and the Chase,3000,159,"dfs and similar, graphs, probabilities, trees"
1361,D,Johnny and James,2900,158,"greedy, implementation, math, trees"
1361,C,Johnny and Megan's Necklace,2500,751,"binary search, bitmasks, constructive algorithms, dfs and similar, dsu, graphs"
1361,B,Johnny and Grandmaster,1900,2244,"greedy, implementation, math, sortings"
1361,A,Johnny and Contribution,1700,5725,"constructive algorithms, graphs, greedy, sortings"
1360,H,Binary Median,2100,2903,"binary search, bitmasks, brute force, constructive algorithms"
1360,G,A/B Matrix,1900,4801,"constructive algorithms, greedy, math"
1360,F,Spy-string,1700,6803,"bitmasks, brute force, constructive algorithms, dp, hashing, strings"
1360,E,Polygon,1300,13312,"dp, graphs, implementation, shortest paths"
1360,D,Buying Shovels,1300,14599,"math, number theory"
1360,C,Similar Pairs,1100,17354,"constructive algorithms, graph matchings, greedy, sortings"
1360,B,Honest Coach,800,20950,"greedy, sortings"
1360,A,Minimal Square,800,21544,"greedy, math"
1359,F,RC Kaboom Show,2900,206,"binary search, brute force, data structures, geometry, math"
1359,E,Modular Stability,2000,3555,"combinatorics, math, number theory"
1359,D,Yet Another Yet Another Task,2000,5065,"data structures, dp, implementation, two pointers"
1359,C,Mixing Water,1700,8168,"binary search, math"
1359,B,New Theatre Square,1000,15834,"brute force, dp, greedy, implementation, two pointers"
1359,A,Berland Poker,1000,17166,"brute force, greedy, math"
1358,F,Tasty Cookie,2700,290,"binary search, constructive algorithms, greedy, implementation"
1358,E,Are You Fired?,2400,1353,"constructive algorithms, data structures, greedy, implementation"
1358,D,The Best Vacation,1900,5521,"binary search, brute force, greedy, implementation, two pointers"
1358,C,Celex Update,1600,10861,math
1358,B,Maria Breaks the Self-isolation,1000,16763,"greedy, sortings"
1358,A,Park Lighting,800,20647,"greedy, math"
1357,E2,Root of quantum Fourier transform,,38,
1357,E1,Power of quantum Fourier transform,,175,
1357,D5,Quantum Classification - Dataset 7,,66,
1357,D4,Quantum Classification - Dataset 6,,72,
1357,D3,Quantum Classification - Dataset 5,,92,
1357,D2,Quantum Classification - Dataset 4,,99,
1357,D1,Quantum Classification - Dataset 3,,112,
1357,C2,Prepare superposition of basis states with the same parity,,286,
1357,C1,Prepare superposition of basis states with 0s,,329,
1357,B2,"""Is the number divisible by 3?"" oracle",,195,
1357,B1,"""Is the bit string balanced?"" oracle",,196,
1357,A7,"Distinguish Y, XZ, -Y and -XZ",,164,
1357,A6,Distinguish four Pauli gates,,147,
1357,A5,Distinguish Rz(θ) from Ry(θ),,217,
1357,A4,Distinguish Rz from R1,,321,
1357,A3,Distinguish H from X,,442,
1357,A2,"Distinguish I, CNOTs and SWAP",,478,
1357,A1,Figure out direction of CNOT,,592,
1356,D2,Quantum Classification - 2,,112,*special
1356,D1,Quantum Classification - 1,,122,*special
1356,C,Prepare state |01⟩ + |10⟩ + |11⟩,,278,*special
1356,B2,Decrement,,256,*special
1356,B1,Increment,,255,*special
1356,A5,Distinguish Z from -Z,,301,*special
1356,A4,Distinguish I ⊗ X from CNOT,,425,*special
1356,A3,Distinguish Z from S,,424,*special
1356,A2,Distinguish I from Z,,448,*special
1356,A1,Distinguish I from X,,561,*special
1355,F,Guess Divisors Count,2600,430,"constructive algorithms, interactive, number theory"
1355,E,Restorer Distance,2100,2697,"binary search, greedy, math, sortings, ternary search"
1355,D,Game With Array,1400,10574,"constructive algorithms, math"
1355,C,Count Triangles,1800,6462,"binary search, implementation, math, two pointers"
1355,B,Young Explorers,1200,13951,"dp, greedy, sortings"
1355,A,Sequence with Digits,1200,15165,"brute force, implementation, math"
1354,G,Find a Gift,2600,306,"binary search, interactive, probabilities"
1354,F,Summoning Minions,2500,519,"constructive algorithms, dp, flows, graph matchings, greedy, sortings"
1354,E,Graph Coloring,2100,1843,"dfs and similar, dp, graphs"
1354,D,Multiset,1900,4731,"binary search, data structures"
1354,C2,Not So Simple Polygon Embedding,2000,4188,"binary search, brute force, geometry, math"
1354,C1,Simple Polygon Embedding,1400,10724,"binary search, geometry, math, ternary search"
1354,B,Ternary String,1200,13812,"binary search, dp, implementation, two pointers"
1354,A,Alarm Clock,900,16064,math
1353,F,Decreasing Heights,2200,1996,"brute force, dp"
1353,E,K-periodic Garland,1900,4235,"brute force, dp, greedy"
1353,D,Constructing the Array,1600,9997,"constructive algorithms, data structures, sortings"
1353,C,Board Moves,1000,19170,math
1353,B,Two Arrays And Swaps,800,22043,"greedy, sortings"
1353,A,Most Unstable Array,800,21603,"constructive algorithms, greedy, math"
1352,G,Special Permutation,1600,9804,constructive algorithms
1352,F,Binary String Reconstruction,1500,8469,"constructive algorithms, dfs and similar, math"
1352,E,Special Elements,1500,9644,"brute force, implementation, two pointers"
1352,D,"Alice, Bob and Candies",1300,13971,implementation
1352,C,K-th Not Divisible by n,1200,18254,"binary search, math"
1352,B,Same Parity Summands,1200,16697,"constructive algorithms, math"
1352,A,Sum of Round Numbers,800,25238,"implementation, math"
1351,C,Skier,1400,4728,"data structures, implementation"
1351,B,Square?,900,8635,"brute force, implementation, math"
1351,A,A+B (Trial Problem),800,10518,implementation
1350,B,Orac and Models,1400,10689,"dp, math, number theory"
1350,A,Orac and Factors,900,16545,math
1349,F2,Slime and Sequences (Hard Version),3500,31,"dp, fft, math"
1349,F1,Slime and Sequences (Easy Version),3100,116,"dp, fft, math"
1349,E,Slime and Hats,3500,23,"constructive algorithms, dp, greedy"
1349,D,Slime and Biscuits,3200,241,"math, probabilities"
1349,C,Orac and Game of Life,2000,2811,"dfs and similar, graphs, implementation, shortest paths"
1349,B,Orac and Medians,2000,4806,"constructive algorithms, greedy, math"
1349,A,Orac and LCM,1600,8757,"data structures, math, number theory"
1348,F,Phoenix and Memory,2600,475,"data structures, dfs and similar, graphs, greedy"
1348,E,Phoenix and Berries,2400,1313,"brute force, dp, greedy, math"
1348,D,Phoenix and Science,1900,5930,"binary search, constructive algorithms, greedy, implementation, math"
1348,C,Phoenix and Distribution,1600,9482,"constructive algorithms, greedy, sortings, strings"
1348,B,Phoenix and Beauty,1400,14249,"constructive algorithms, data structures, greedy, sortings"
1348,A,Phoenix and Balance,800,22334,"greedy, math"
1346,I,Pac-Man 2.0,2900,15,"*special, dp"
1346,H,Game with Segments,2700,20,"*special, data structures, games"
1346,G,Two IP Cameras,2300,78,"*special, math, number theory"
1346,F,Dune II: Battle For Arrakis,2000,144,"*special, data structures, greedy, math"
1346,E,Magic Tricks,1700,203,"*special, dp, graphs"
1346,D,Constructing the Dungeon,1600,306,"*special, graphs, greedy"
1346,C,Spring Cleaning,1600,395,"*special, greedy, sortings"
1346,B,Boot Camp,1400,761,"*special, greedy"
1346,A,Color Revolution,1000,1215,"*special, math"
1345,B,Card Constructions,1100,15047,"binary search, brute force, dp, math"
1345,A,Puzzle Pieces,800,17386,math
1344,F,Piet's Palette,3200,84,matrices
1344,E,Train Tracks,3100,66,"data structures, trees"
1344,D,Résumé Review,2700,520,"binary search, greedy, math"
1344,C,Quantifier Question,2600,1128,"dfs and similar, dp, graphs, math"
1344,B,Monopole Magnets,2000,4138,"constructive algorithms, dfs and similar, dsu, graphs"
1344,A,Hilbert's Hotel,1600,9949,"math, number theory, sortings"
1343,F,Restore the Permutation by Sorted Segments,2400,823,"brute force, constructive algorithms, data structures, greedy, implementation"
1343,E,Weights Distributing,2100,3201,"brute force, graphs, greedy, shortest paths, sortings"
1343,D,Constant Palindrome Sum,1700,7823,"brute force, data structures, greedy, two pointers"
1343,C,Alternating Subsequence,1200,18843,"dp, greedy, two pointers"
1343,B,Balanced Array,800,24679,"constructive algorithms, math"
1343,A,Candies,900,24221,"brute force, math"
1342,F,Make It Ascending,3000,201,"bitmasks, brute force, dp"
1342,E,Placing Rooks,2300,1479,"combinatorics, fft, math"
1342,D,Multiple Testcases,1900,4410,"binary search, constructive algorithms, data structures, greedy, sortings, two pointers"
1342,C,Yet Another Counting Problem,1600,9223,"math, number theory"
1342,B,Binary Period,1100,16357,"constructive algorithms, strings"
1342,A,Road To Zero,1000,19828,"greedy, math"
1341,B,Nastya and Door,1300,13399,"greedy, implementation"
1341,A,Nastya and Rice,900,18601,math
1340,F,Nastya and CBS,3300,97,"brute force, data structures, hashing"
1340,E,Nastya and Bees,3000,36,"graphs, interactive, probabilities"
1340,D,Nastya and Time Machine,2600,470,"constructive algorithms, dfs and similar, graphs, trees"
1340,C,Nastya and Unexpected Guest,2400,1419,"dfs and similar, dp, graphs, shortest paths"
1340,B,Nastya and Scoreboard,1700,5464,"bitmasks, dp, graphs, greedy"
1340,A,Nastya and Strange Generator,1500,10481,"brute force, data structures, greedy, implementation"
1339,B,Sorted Adjacent Differences,1200,15072,"constructive algorithms, sortings"
1339,A,Filling Diamonds,900,18190,"brute force, dp, implementation, math"
1338,E,JYPnation,3500,72,graphs
1338,D,Nested Rubber Bands,2700,418,"constructive algorithms, dfs and similar, dp, math, trees"
1338,C,Perfect Triples,2200,2134,"bitmasks, brute force, constructive algorithms, divide and conquer, math"
1338,B,Edge Weight Assignment,1800,5452,"bitmasks, constructive algorithms, dfs and similar, greedy, math, trees"
1338,A,Powered Addition,1500,13088,"greedy, math"
1337,B,Kana and Dragon Quest game,900,19733,"greedy, implementation, math"
1337,A,Ichihime and Triangle,800,20331,"constructive algorithms, math"
1336,F,Journey,3500,71,"data structures, divide and conquer, graphs, trees"
1336,E2,Chiori and Doll Picking (hard version),3500,99,"bitmasks, brute force, combinatorics, math"
1336,E1,Chiori and Doll Picking (easy version),2700,383,"bitmasks, brute force, combinatorics, math"
1336,D,Yui and Mahjong Set,3200,273,"constructive algorithms, interactive"
1336,C,Kaavi and Magic Spell,2200,2223,"dp, strings"
1336,B,Xenia and Colorful Gems,1700,7558,"binary search, greedy, math, sortings, two pointers"
1336,A,Linova and Kingdom,1600,10672,"dfs and similar, dp, greedy, sortings, trees"
1335,F,Robots on a Grid,2200,1329,"data structures, dfs and similar, dsu, graphs, greedy, matrices"
1335,E2,Three Blocks Palindrome (hard version),1800,5100,"brute force, data structures, dp, two pointers"
1335,E1,Three Blocks Palindrome (easy version),1700,6870,"binary search, brute force, data structures, dp, two pointers"
1335,D,Anti-Sudoku,1300,16084,"constructive algorithms, implementation"
1335,C,Two Teams Composing,1100,18992,"binary search, greedy, implementation, sortings"
1335,B,Construct the String,900,21459,constructive algorithms
1335,A,Candies and Two Sisters,800,28297,math
1334,G,Substring Search,2900,203,"bitmasks, brute force, fft"
1334,F,Strange Function,2500,607,"binary search, data structures, dp, greedy"
1334,E,Divisor Paths,2200,1673,"combinatorics, graphs, greedy, math, number theory"
1334,D,Minimum Euler Cycle,1800,5005,"constructive algorithms, graphs, greedy, implementation"
1334,C,Circle of Monsters,1600,10075,"brute force, constructive algorithms, greedy, math"
1334,B,Middle Class,1100,16099,"greedy, sortings"
1334,A,Level Statistics,1200,15813,"implementation, math"
1333,F,Kate and imperfection,2200,2831,"greedy, implementation, math, number theory, sortings, two pointers"
1333,E,Road to 1600,2400,922,"brute force, constructive algorithms"
1333,D,Challenges in school №41,2100,2899,"brute force, constructive algorithms, games, graphs, greedy, implementation, sortings"
1333,C,Eugene and an array,1700,7869,"binary search, data structures, implementation, two pointers"
1333,B,Kind Anton,1100,15113,"greedy, implementation"
1333,A,Little Artem,1000,16755,constructive algorithms
1332,G,No Monotone Triples,3100,147,data structures
1332,F,Independent Set,2500,664,"dfs and similar, dp, trees"
1332,E,Height All the Same,2100,2521,"combinatorics, constructive algorithms, math, matrices"
1332,D,Walk on Matrix,1700,5919,"bitmasks, constructive algorithms, math"
1332,C,K-Complete Word,1500,9694,"dfs and similar, dsu, greedy, implementation, strings"
1332,B,Composite Coloring,1400,10994,"brute force, constructive algorithms, greedy, math, number theory"
1332,A,Exercising Walk,1100,15030,"greedy, implementation, math"
1331,H,It's showtime,,455,
1331,G,Lingua Romana,,375,
1331,F,Elementary!,,415,"brute force, dp, strings"
1331,E,Jordan Smiley,,986,"dfs and similar, geometry, implementation"
1331,D,Again?,,10087,implementation
1331,C,...And after happily lived ever they,,2629,bitmasks
1331,B,Limericks,,5750,"math, number theory"
1331,A,Is it rated?,,13114,
1330,B,Dreamoon Likes Permutations,1400,9748,"implementation, math"
1330,A,Dreamoon and Ranking Collection,900,14215,implementation
1329,E,Dreamoon Loves AA,3300,52,"binary search, greedy"
1329,D,Dreamoon Likes Strings,3100,149,"constructive algorithms, data structures"
1329,C,Drazil Likes Heap,2400,1157,"constructive algorithms, data structures, greedy, implementation"
1329,B,Dreamoon Likes Sequences,1700,4524,"bitmasks, combinatorics, math"
1329,A,Dreamoon Likes Coloring,1800,6247,"constructive algorithms, greedy, implementation, math"
1328,F,Make k Equal,2200,2087,greedy
1328,E,Tree Queries,1900,4435,"dfs and similar, graphs, trees"
1328,D,Carousel,1800,7594,"constructive algorithms, dp, graphs, greedy, math"
1328,C,Ternary XOR,1200,17121,"greedy, implementation"
1328,B,K-th Beautiful String,1300,16191,"binary search, brute force, combinatorics, implementation, math"
1328,A,Divisibility Problem,800,29856,math
1327,G,Letters and Question Marks,2800,237,"bitmasks, dp, string suffix structures"
1327,F,AND Segments,2500,715,"bitmasks, combinatorics, data structures, dp, two pointers"
1327,E,Count The Blocks,1800,5575,"combinatorics, dp, math"
1327,D,Infinite Path,2200,2262,"brute force, dfs and similar, graphs, math, number theory"
1327,C,Game with Chips,1600,8921,"constructive algorithms, implementation"
1327,B,Princesses and Princes,1200,13080,"brute force, graphs, greedy"
1327,A,Sum of Odd Integers,1100,18893,math
1326,G,Spiderweb Trees,3500,22,"dp, geometry, trees"
1326,F2,Wise Men (Hard Version),3200,144,"bitmasks, dp, math"
1326,F1,Wise Men (Easy Version),2600,471,"bitmasks, brute force, dp, meet-in-the-middle"
1326,E,Bombs,2400,1286,"data structures, two pointers"
1326,D2,Prefix-Suffix Palindrome (Hard version),1800,5672,"binary search, greedy, hashing, string suffix structures, strings"
1326,D1,Prefix-Suffix Palindrome (Easy version),1500,7699,"hashing, string suffix structures, strings"
1326,C,Permutation Partitions,1300,10680,"combinatorics, greedy, math"
1326,B,Maximums,900,15941,"implementation, math"
1326,A,Bad Ugly Numbers,1000,16465,"constructive algorithms, number theory"
1325,F,Ehab's Last Theorem,2500,968,"constructive algorithms, dfs and similar, graphs, greedy"
1325,E,Ehab's REAL Number Theory Problem,2600,1147,"brute force, dfs and similar, graphs, number theory, shortest paths"
1325,D,Ehab the Xorcist,1700,6980,"bitmasks, constructive algorithms, greedy, number theory"
1325,C,Ehab and Path-etic MEXs,1500,8508,"constructive algorithms, dfs and similar, greedy, trees"
1325,B,CopyCopyCopyCopyCopy,800,18921,"greedy, implementation"
1325,A,EhAb AnD gCd,800,18887,"constructive algorithms, greedy, number theory"
1324,F,Maximum White Subtree,1800,3840,"dfs and similar, dp, graphs, trees"
1324,E,Sleeping Schedule,1700,6275,"dp, implementation"
1324,D,Pair of Topics,1400,11530,"binary search, data structures, sortings, two pointers"
1324,C,Frog Jumps,1100,14650,"binary search, data structures, dfs and similar, greedy, implementation"
1324,B,Yet Another Palindrome Problem,1100,15578,"brute force, strings"
1324,A,Yet Another Tetris Problem,900,16653,"implementation, number theory"
1323,B,Count Subrectangles,1500,5634,"binary search, greedy, implementation"
1323,A,Even Subset Sum Problem,800,12173,"brute force, dp, greedy, implementation"
1322,F,Assigning Fares,3500,25,"dp, trees"
1322,E,Median Mountain Range,3300,68,data structures
1322,D,Reality Show,2800,303,"bitmasks, dp"
1322,C,Instant Noodles,2300,1100,"graphs, hashing, math, number theory"
1322,B,Present,2100,2284,"binary search, bitmasks, constructive algorithms, data structures, math, sortings"
1322,A,Unusual Competitions,1300,8430,greedy
1321,C,Remove Adjacent,1600,5831,"brute force, constructive algorithms, greedy, strings"
1321,A,Contest for Robots,900,9969,greedy
1320,F,Blocks and Sensors,3500,35,brute force
1320,E,Treeland and Viruses,3000,253,"data structures, dfs and similar, dp, shortest paths, trees"
1320,D,Reachable Strings,2500,687,"data structures, hashing, strings"
1320,C,World of Darkraft: Battle for Azathoth,2000,1984,"brute force, data structures, sortings"
1320,B,Navigation System,1700,3996,"dfs and similar, graphs, shortest paths"
1320,A,Journey Planning,1400,9087,"data structures, dp, greedy, math, sortings"
1316,F,Battalion Strength,2800,268,"data structures, divide and conquer, probabilities"
1316,E,Team Building,2300,1550,"bitmasks, dp, greedy, sortings"
1316,D,Nash Matrix,2000,2346,"constructive algorithms, dfs and similar, graphs, implementation"
1316,C,Primitive Primes,1800,5055,"constructive algorithms, math, ternary search"
1316,B,String Modification,1400,7391,"brute force, constructive algorithms, implementation, sortings, strings"
1316,A,Grade Allocation,800,13589,implementation
1315,C,Restoring Permutation,1200,5821,greedy
1315,B,Homecoming,1300,5535,"binary search, dp, greedy, strings"
1315,A,Dead Pixel,800,8476,implementation
1313,E,Concatenation with intersection,2700,231,"data structures, hashing, strings, two pointers"
1313,D,Happy New Year,2500,449,"bitmasks, dp, implementation"
1313,C2,Skyscrapers (hard version),1900,3464,"data structures, dp, greedy"
1313,C1,Skyscrapers (easy version),1500,5980,"brute force, data structures, dp, greedy"
1313,B,Different Rules,1700,4450,"constructive algorithms, greedy, implementation, math"
1313,A,Fast Food Restaurant,900,10393,"brute force, greedy, implementation"
1312,G,Autocompletion,2600,443,"data structures, dfs and similar, dp"
1312,F,Attack on Red Kingdom,2500,433,"games, two pointers"
1312,E,Array Shrinking,2100,2901,"dp, greedy"
1312,D,Count the Arrays,1700,5448,"combinatorics, math"
1312,C,Adding Powers,1400,9622,"bitmasks, greedy, implementation, math, number theory, ternary search"
1312,B,Bogosort,1000,14142,"constructive algorithms, sortings"
1312,A,Two Regular Polygons,800,16319,"geometry, greedy, math, number theory"
1311,F,Moving Points,1900,2180,"data structures, divide and conquer, implementation, sortings"
1311,E,Construct the Binary Tree,2200,1196,"brute force, constructive algorithms, trees"
1311,D,Three Integers,2000,5313,"brute force, math"
1311,C,Perform the Combo,1300,10073,brute force
1311,B,WeirdSort,1200,11563,"dfs and similar, sortings"
1311,A,Add Odd or Subtract Even,800,20070,"greedy, implementation, math"
1310,F,Bad Cryptography,3400,28,"math, number theory"
1310,E,Strange Function,2900,102,dp
1310,D,Tourism,2300,721,"dp, graphs, probabilities"
1310,C,Au Pont Rouge,2800,194,"binary search, dp, strings"
1310,B,Double Elimination,2500,324,"dp, implementation"
1310,A,Recommendations,1700,3269,"data structures, greedy, sortings"
1307,G,Cow and Exercise,3100,134,"flows, graphs, shortest paths"
1307,F,Cow and Vacation,3300,227,"dfs and similar, dsu, trees"
1307,E,Cow and Treats,2500,741,"binary search, combinatorics, dp, greedy, implementation, math"
1307,D,Cow and Fields,1900,3690,"binary search, data structures, dfs and similar, graphs, greedy, shortest paths, sortings"
1307,C,Cow and Message,1500,7180,"brute force, dp, math, strings"
1307,B,Cow and Friend,1300,8920,"geometry, greedy, math"
1307,A,Cow and Haybales,800,11651,"greedy, implementation"
1305,H,Kuroni the Private Tutor,3500,28,"binary search, greedy"
1305,G,Kuroni and Antihype,3500,191,"bitmasks, brute force, dp, dsu, graphs"
1305,F,Kuroni and the Punishment,2500,1129,"math, number theory, probabilities"
1305,E,Kuroni and the Score Distribution,2200,2039,"constructive algorithms, greedy, implementation, math"
1305,D,Kuroni and the Celebration,1900,3288,"constructive algorithms, dfs and similar, interactive, trees"
1305,C,Kuroni and Impossible Calculation,1600,7529,"brute force, combinatorics, math, number theory"
1305,B,Kuroni and Simple Strings,1200,7843,"constructive algorithms, greedy, strings, two pointers"
1305,A,Kuroni and the Gifts,800,10686,"brute force, constructive algorithms, greedy, sortings"
1304,F2,Animal Observation (hard version),2400,718,"data structures, dp, greedy"
1304,F1,Animal Observation (easy version),2300,950,"data structures, dp"
1304,E,1-Trees and Queries,2000,2815,"data structures, dfs and similar, shortest paths, trees"
